{
  "$schema": "https://json-schema.org/draft/2020-12/schema",
  "title": "Ubicon device record",
  "type": "object",
  "required": ["id", "name", "category", "keywords", "icon"],
  "additionalProperties": false,
  "properties": {
    "id": { "type": "string", "pattern": "^[a-z0-9]+(-[a-z0-9]+)*$", "description": "Permanent unique slug" },
    "name": { "type": "string", "minLength": 1 },
    "type": { "type": "string", "enum": ["real", "generic"], "description": "real = a specific branded product (default); generic = a brandless device-type fallback icon" },
    "vendor": { "type": "string", "minLength": 1, "description": "Required for real devices; omitted for generic ones" },
    "model": { "type": "string", "minLength": 1, "description": "Required for real devices; omitted for generic ones" },
    "category": { "type": "string", "enum": ["camera", "doorbell", "smart_lock", "smart_plug", "light", "sensor", "thermostat", "hvac", "speaker", "av", "tv", "game_console", "computer", "phone", "tablet", "printer", "3d_printer", "nas", "network", "appliance", "energy", "vehicle", "iot_hub", "wearable", "other"] },
    "keywords": { "type": "array", "items": { "type": "string" } },
    "icon": { "type": "string", "pattern": "^icons/[a-z0-9-]+\\.png$" },
    "contributor": { "type": "string", "maxLength": 60, "description": "Credit for who contributed this entry" }
  }
}
